{
  "contract_name": "help_catalog_v1",
  "schema_version": "1.0.0",
  "record_origin": "versioned_help_catalog",
  "sections": [
    {
      "section_id": "getting_started",
      "order": 1,
      "title": "Как начать",
      "articles": [
        {
          "article_id": "quick_start",
          "title": "Первый расчет",
          "summary": "Короткий путь от файла кампании до результата и отчета.",
          "body": [
            {
              "block_type": "steps",
              "items": [
                "Откройте новый расчет и загрузите файл с одной будущей кампанией.",
                "Дождитесь проверки полей, бюджета, каналов и географий.",
                "Исправьте блокирующие ошибки или подтвердите запуск при предупреждениях.",
                "Следите за этапами расчета, затем откройте результат и отчет."
              ]
            },
            {
              "block_type": "note",
              "tone": "info",
              "title": "Что оценивает результат",
              "text": "Система оценивает дополнительный эффект медиаплана относительно варианта без этой кампании и помогает сравнить распределения бюджета."
            }
          ],
          "related_routes": ["/calculations/new", "/calculations"],
          "related_article_ids": ["campaign_file_fields", "effect_and_uncertainty"],
          "keywords": ["первый расчет", "загрузка", "запуск"]
        }
      ]
    },
    {
      "section_id": "data_preparation",
      "order": 2,
      "title": "Подготовка данных",
      "articles": [
        {
          "article_id": "campaign_file_fields",
          "title": "Что должно быть в файле кампании",
          "summary": "Поля, по которым система восстанавливает период, бюджет и структуру медиаплана.",
          "body": [
            {
              "block_type": "paragraph",
              "text": "Для каждой строки нужны название кампании, сегмент, даты или дневная дата, география, канал, целевой показатель и бюджет. Один расчет принимает одну кампанию."
            },
            {
              "block_type": "paragraph",
              "text": "Если указан интервал, бюджет строки распределяется по активным дням. Если в файле уже есть дневные даты, они имеют приоритет."
            },
            {
              "block_type": "note",
              "tone": "warning",
              "title": "Проверяйте сумму",
              "text": "До запуска сравните общий бюджет после проверки с исходным бюджетом файла. Неизвестные каналы, географии или сочетания могут заблокировать расчет."
            }
          ],
          "related_routes": ["/calculations/new"],
          "related_article_ids": ["input_and_calculation_errors"],
          "keywords": ["поля файла", "бюджет", "даты", "каналы", "географии"]
        }
      ]
    },
    {
      "section_id": "scenarios",
      "order": 3,
      "title": "Сценарии S1-S6",
      "articles": [
        {
          "article_id": "scenarios_s1_s6",
          "title": "Зачем нужны шесть сценариев",
          "summary": "Пять понятных ориентиров и отдельный адаптивный поиск распределения бюджета.",
          "body": [
            {
              "block_type": "steps",
              "items": [
                "S1 сохраняет загруженный медиаплан без изменений.",
                "S2 делит бюджет поровну между исходными сочетаниями географии и канала.",
                "S3 сохраняет бюджеты каналов и выравнивает географии внутри каждого канала.",
                "S4 сохраняет бюджеты географий и выравнивает каналы внутри каждой географии.",
                "S5 формирует устойчивый ориентир с учетом наблюдаемой исторической зоны.",
                "S6 перебирает варианты перераспределения и отдельно учитывает ограничения надежности."
              ]
            },
            {
              "block_type": "note",
              "tone": "warning",
              "title": "Рекомендация относится к распределению",
              "text": "Выбранный сценарий не является автоматическим решением запускать или отменять кампанию. Он отвечает на вопрос о распределении заданного бюджета."
            }
          ],
          "related_routes": ["/calculations"],
          "related_article_ids": ["reliability_and_support", "media_plan_distribution"],
          "keywords": ["сценарии", "S1", "S5", "S6", "распределение"]
        }
      ]
    },
    {
      "section_id": "result_reading",
      "order": 4,
      "title": "Как читать результат",
      "articles": [
        {
          "article_id": "effect_and_uncertainty",
          "title": "Эффект, ROAS и диапазон неопределенности",
          "summary": "Как сопоставлять центральную оценку с осторожной и оптимистичной границами.",
          "body": [
            {
              "block_type": "paragraph",
              "text": "Incremental turnover показывает дополнительный оборот относительно варианта без кампании. ROAS делит этот эффект на рассчитанный рекламный бюджет."
            },
            {
              "block_type": "paragraph",
              "text": "P50 является центральной оценкой. P10 показывает более осторожный исход, а P90 — более высокий исход в рамках posterior-неопределенности модели."
            },
            {
              "block_type": "note",
              "tone": "warning",
              "title": "Не путайте с общим оборотом",
              "text": "Это не прогноз полного оборота бизнеса. Количество заказов остается диагностическим показателем и не управляет автоматической рекомендацией."
            }
          ],
          "related_routes": ["/calculations"],
          "related_article_ids": ["reliability_and_support", "current_limitations"],
          "keywords": ["эффект", "ROAS", "P10", "P50", "P90"]
        }
      ]
    },
    {
      "section_id": "reliability",
      "order": 5,
      "title": "Надежность",
      "articles": [
        {
          "article_id": "reliability_and_support",
          "title": "Почему историческая зона важна",
          "summary": "Чем дальше будущий бюджет от наблюдавшихся значений, тем осторожнее должна быть интерпретация.",
          "body": [
            {
              "block_type": "paragraph",
              "text": "Для каждого сочетания система сопоставляет будущую интенсивность расходов с исторической поддержкой модели. Выход за привычную зону не означает запрет рекламы, но ограничивает автоматическое перераспределение."
            },
            {
              "block_type": "paragraph",
              "text": "Каналы с короткой историей или слабой идентификацией могут быть разрешены только с осторожностью либо оставлены как диагностика."
            },
            {
              "block_type": "note",
              "tone": "info",
              "title": "Как выбирать",
              "text": "Смотрите одновременно на P10-P90, предупреждения, доступность безопасного варианта и величину практического улучшения относительно исходного плана."
            }
          ],
          "related_routes": ["/model", "/calculations"],
          "related_article_ids": ["scenarios_s1_s6", "effect_and_uncertainty"],
          "keywords": ["надежность", "историческая зона", "предупреждения", "support"]
        }
      ]
    },
    {
      "section_id": "media_plan",
      "order": 6,
      "title": "Медиаплан",
      "articles": [
        {
          "article_id": "media_plan_distribution",
          "title": "Как читать распределение бюджета",
          "summary": "Строки медиаплана показывают, куда конкретный сценарий направляет бюджет.",
          "body": [
            {
              "block_type": "paragraph",
              "text": "Для выбранного уже рассчитанного сценария медиаплан показывает бюджет по каналам и географиям. Выбор сценария на странице только меняет просмотр и не пересчитывает победителя."
            },
            {
              "block_type": "paragraph",
              "text": "Сравнивайте распределение с S1, чтобы увидеть, какие суммы перемещены. Фильтры помогают найти конкретный канал или географию."
            },
            {
              "block_type": "note",
              "tone": "warning",
              "title": "Текущая детализация",
              "text": "Дневная раскладка всех сценариев и рабочий редактируемый файл медиаплана сейчас не публикуются как отдельный продуктовый результат."
            }
          ],
          "related_routes": ["/calculations"],
          "related_article_ids": ["scenarios_s1_s6", "marketer_report"],
          "keywords": ["медиаплан", "канал", "география", "бюджет"]
        }
      ]
    },
    {
      "section_id": "report",
      "order": 7,
      "title": "Отчет",
      "articles": [
        {
          "article_id": "marketer_report",
          "title": "Что находится в отчете для маркетолога",
          "summary": "Excel объединяет описание кампании, сценарии, рекомендацию и объяснение качества.",
          "body": [
            {
              "block_type": "paragraph",
              "text": "Отчет создается тем же расчетом, что и результат в браузере. В нем собраны параметры кампании, оценки сценариев, рекомендованное распределение и предупреждения понятным языком."
            },
            {
              "block_type": "paragraph",
              "text": "Скачивайте файл только из завершенного расчета. Если отчет недоступен, результат может оставаться доступным для просмотра, но флаг отчета будет показан отдельно."
            }
          ],
          "related_routes": ["/calculations"],
          "related_article_ids": ["effect_and_uncertainty", "media_plan_distribution"],
          "keywords": ["отчет", "Excel", "скачивание", "результат"]
        }
      ]
    },
    {
      "section_id": "common_errors",
      "order": 8,
      "title": "Частые ошибки",
      "articles": [
        {
          "article_id": "input_and_calculation_errors",
          "title": "Что делать при ошибке",
          "summary": "Различайте ошибки входного файла, временную недоступность и несогласованный результат.",